{
  "capabilities_result_schema_version": "2.0.0",
  "product_version": "0.2.0",
  "cli_api_version": "1.0.0",
  "enabled_features": [],
  "product_resources": {
    "resource_set_version": "1.0.0",
    "origin": "embedded",
    "resource_count": 240,
    "resource_set_sha256": "dc61cc012f983297fef864f68e6cd172a9d33ac9ad4faab4cc66d3526b688410",
    "resources": [
      {
        "logical_path": "Cargo.lock",
        "size_bytes": 41997,
        "sha256": "4aa4b6c94043fb2f236ec888ac9b253f2ff451b666464609f81f82aaac6d8a4d"
      },
      {
        "logical_path": "assets/dcmtk_srgb_input_profile.hex",
        "size_bytes": 1473,
        "sha256": "249dd54ff7fc219611e1f8ed459dbf9632ac9974753b7ebc7feea6e917804e84"
      },
      {
        "logical_path": "cases/recipes/classic/cr/cr_overlay_modality_voi.json",
        "size_bytes": 4013,
        "sha256": "7ee5bd86e7a83db9b484ce4cdb2f12243616749fdf392ec155ff3d7604b8c8d1"
      },
      {
        "logical_path": "cases/recipes/classic/cr/cr_overlay_modality_voi_rle_lossless.json",
        "size_bytes": 4250,
        "sha256": "454812763f60ba9d8a379ffb83259c31da983566d9e239be6a46db80d23007fa"
      },
      {
        "logical_path": "cases/recipes/classic/ct/ct_mono2_i16_rescale.json",
        "size_bytes": 3938,
        "sha256": "f014e51c72b094dd188267fbe6a36e3caeebc6828fcc415045fcb02a758a84ca"
      },
      {
        "logical_path": "cases/recipes/classic/ct/ct_mono2_i16_rescale_rle_lossless.json",
        "size_bytes": 4175,
        "sha256": "5636ff2c408e85080124d175a6ac55ce8bff3c97876005828e3948543d2457c5"
      },
      {
        "logical_path": "cases/recipes/classic/dx/dx_display_shutter_mono2_u16.json",
        "size_bytes": 4037,
        "sha256": "82228d5ef2be7496cf084c41b7b885bb31b3c6f911e93211f92158f71768bb68"
      },
      {
        "logical_path": "cases/recipes/classic/dx/dx_display_shutter_mono2_u16_rle_lossless.json",
        "size_bytes": 5101,
        "sha256": "5dab8e4a22e8332fd607b7c41569ccee1a1b09d8169576c3b6f62599e4e89ca7"
      },
      {
        "logical_path": "cases/recipes/classic/mg/mg_for_presentation_mono1_u16.json",
        "size_bytes": 4160,
        "sha256": "4c963fca2cacab5f78dc28eae701278a4dc0445d06fef0f15d17a0afba9e76aa"
      },
      {
        "logical_path": "cases/recipes/classic/mg/mg_for_presentation_mono1_u16_rle_lossless.json",
        "size_bytes": 4397,
        "sha256": "0cb72911b49b7089281ceedea156a8d5538527a0411a84596523094b81c21955"
      },
      {
        "logical_path": "cases/recipes/classic/mg/mg_for_processing_mono2_u16.json",
        "size_bytes": 4694,
        "sha256": "cec2846945593d2d6c70e2faf839b459045c67128a082eee59f673262de07d78"
      },
      {
        "logical_path": "cases/recipes/classic/mg/mg_for_processing_mono2_u16_rle_lossless.json",
        "size_bytes": 6053,
        "sha256": "ff119ec17cd7a58c964958273fd347df40f75ec1776b21c3f3ed6cc3e19501ae"
      },
      {
        "logical_path": "cases/recipes/classic/mr/mr_mono2_u16_rle_lossless.json",
        "size_bytes": 3438,
        "sha256": "6187ac7f6c1c83933c381ceade833741415ecf07daa9fe2d3de4b403769fd736"
      },
      {
        "logical_path": "cases/recipes/classic/mr/mr_multislice_oblique.json",
        "size_bytes": 9104,
        "sha256": "c894c52053d4414e170f8f30b4be2786bcb5985153a763034707f241cc886526"
      },
      {
        "logical_path": "cases/recipes/classic/nm/classic_nm_multiframe_explicit_le.json",
        "size_bytes": 5769,
        "sha256": "f095ec6e49c06920bf6fb60edb75b138cf578650a9ff81bb4567c50e5e0964ad"
      },
      {
        "logical_path": "cases/recipes/classic/pet/classic_pet_rescaled_activity_explicit_le.json",
        "size_bytes": 4486,
        "sha256": "aa5bb7c928daa315242c9b144b01fafcb68fbfd87d4e8edace475822edc6db9e"
      },
      {
        "logical_path": "cases/recipes/classic/sc/classic_sc_mono2_u16_htj2k_lossy.json",
        "size_bytes": 21965,
        "sha256": "2739d91093c562528081d5d1570d4b2ceb55cb923b855af7ffba08754909b142"
      },
      {
        "logical_path": "cases/recipes/classic/sc/classic_sc_mono2_u1_native.json",
        "size_bytes": 3394,
        "sha256": "19383b00380ccd265e3bd475b22945a184a1f8c82890079f2018f6f88bb5136d"
      },
      {
        "logical_path": "cases/recipes/classic/sc/classic_sc_mono2_u32_explicit_le.json",
        "size_bytes": 2661,
        "sha256": "8ba0633ff11f6e0c78abd362425e0a869d234b250cdb5f6e06e6ba73277807a4"
      },
      {
        "logical_path": "cases/recipes/classic/sc/classic_sc_nonsquare_pixel_spacing.json",
        "size_bytes": 6576,
        "sha256": "0425d30c3e6e8b8ede125d719f231770e0164cb0d294c0887f4c3e18494d7a1b"
      },
      {
        "logical_path": "cases/recipes/classic/sc/classic_sc_rgb_jpegxl_lossy.json",
        "size_bytes": 54021,
        "sha256": "9e131842ba5128ffe1875882d7421a6c05e20b9bf7c30c75d862dfcbd9275d07"
      },
      {
        "logical_path": "cases/recipes/classic/sc/sc_mono1_i16_multiframe_rle_lossless.json",
        "size_bytes": 3003,
        "sha256": "75c2ab16b2d9c6a7371f0053119247e2c09413f5268db073a47bf86fc02ca0af"
      },
      {
        "logical_path": "cases/recipes/classic/sc/sc_mono1_i16_odd_3x3_rle_lossless.json",
        "size_bytes": 2948,
        "sha256": "96c428beeed091e906e51ccf894968c212058187d4f7f5265973e213d96bf34a"
      },
      {
        "logical_path": "cases/recipes/classic/sc/sc_mono1_i16_padding_multiframe_rle_lossless.json",
        "size_bytes": 3186,
        "sha256": "8c35c6ec4deb10602c316f088c3b6d4fe5fb3582de2ca1b3b83c92393f949a16"
      },
      {
        "logical_path": "cases/recipes/classic/sc/sc_mono1_i16_padding_rle_lossless.json",
        "size_bytes": 3005,
        "sha256": "320428ce238c995d0efc054cbfbe6cd429e31c705af9c1540138ae1168dc403d"
      },
      {
        "logical_path": "cases/recipes/classic/sc/sc_mono1_i16_rect_2x3_rle_lossless.json",
        "size_bytes": 2849,
        "sha256": "71a19f0859802ea6367feb3008d387ab0e7d858bbff95b236d8a3c69818bca83"
      },
      {
        "logical_path": "cases/recipes/classic/sc/sc_mono1_i16_rle_lossless.json",
        "size_bytes": 2800,
        "sha256": "c2336feb28dfe8cc9f8cd9880560eab9ed36d1ffcb49d8b5f8a80461fe8b6422"
      },
      {
        "logical_path": "cases/recipes/classic/sc/sc_mono1_i16_tiny_1x1_rle_lossless.json",
        "size_bytes": 2760,
        "sha256": "303bc5981e4be952fc38a9ae612acf170211a09a6fc4c7f49146de949eedcc74"
      },
      {
        "logical_path": "cases/recipes/classic/sc/sc_mono1_u16_multiframe_rle_lossless.json",
        "size_bytes": 2974,
        "sha256": "8716f868d447ed0f0b7d54c1fef4d56768b2d03121063a7e1c20c802b42042a5"
      },
      {
        "logical_path": "cases/recipes/classic/sc/sc_mono1_u16_odd_3x3_rle_lossless.json",
        "size_bytes": 2936,
        "sha256": "77f4d5174cb5b5f28da6040a6c911e2ff65c3381db49a8e53be6e1e9ab2b5119"
      },
      {
        "logical_path": "cases/recipes/classic/sc/sc_mono1_u16_padding_multiframe_rle_lossless.json",
        "size_bytes": 3149,
        "sha256": "6eef2f9de45947604729bb8cae514c721d95e8b2d709bb8e78cf239ed0931787"
      },
      {
        "logical_path": "cases/recipes/classic/sc/sc_mono1_u16_padding_rle_lossless.json",
        "size_bytes": 2974,
        "sha256": "2e4469a96197e2b7ea30cad7521a6fa38ce9857aeebef5a1b96697f54d005dff"
      },
      {
        "logical_path": "cases/recipes/classic/sc/sc_mono1_u16_rect_2x3_rle_lossless.json",
        "size_bytes": 2838,
        "sha256": "00bb36b2e86fffe614b0484ca02b1419f89ddbb726e0c2ebcc64a71b3df569c6"
      },
      {
        "logical_path": "cases/recipes/classic/sc/sc_mono1_u16_rle_lossless.json",
        "size_bytes": 2818,
        "sha256": "e4a0b294d06d91f01125aba1113b0292303011bdfb51d148523a5df0eab345f3"
      },
      {
        "logical_path": "cases/recipes/classic/sc/sc_mono1_u16_tiny_1x1_rle_lossless.json",
        "size_bytes": 2759,
        "sha256": "633f973b19a4576a7294efa61de1fdafa062fd0dcd35caec4d08ee011e3107bc"
      },
      {
        "logical_path": "cases/recipes/classic/sc/sc_mono1_u8.json",
        "size_bytes": 2434,
        "sha256": "38824e9f8fa8189675753e815e7c87a914f1c37f95f50e630365ae5dc7ae5096"
      },
      {
        "logical_path": "cases/recipes/classic/sc/sc_mono1_u8_multiframe_rle_lossless.json",
        "size_bytes": 2931,
        "sha256": "63fc83a526dd4578391265312c49809ac334095153091ad02ebacfed32f1774a"
      },
      {
        "logical_path": "cases/recipes/classic/sc/sc_mono1_u8_odd_fragment_rle_lossless.json",
        "size_bytes": 2837,
        "sha256": "e61772e4374dd367209b1da84d17ecd8949d4e6f9464097f1dcd47e059ac3cd6"
      },
      {
        "logical_path": "cases/recipes/classic/sc/sc_mono1_u8_padding_multiframe_rle_lossless.json",
        "size_bytes": 3137,
        "sha256": "846d6ccc05a332048ab8e8f4c15b4d8bafa413d5316cba3aab897376e5940529"
      },
      {
        "logical_path": "cases/recipes/classic/sc/sc_mono1_u8_padding_rle_lossless.json",
        "size_bytes": 2966,
        "sha256": "1c025ae6e11355a3c1793b237bf53ae7d2637e1254635c9845e529f7af7ff281"
      },
      {
        "logical_path": "cases/recipes/classic/sc/sc_mono1_u8_rle_lossless.json",
        "size_bytes": 2707,
        "sha256": "f2f1a5f7b0263976d4612deff165c7c3de6a7d12dd5924bbd28621f64b82b2ef"
      },
      {
        "logical_path": "cases/recipes/classic/sc/sc_mono2_i16.json",
        "size_bytes": 2488,
        "sha256": "5db3627d4d5add59a92e6271306a48afb8316dada1b081b1224f5570336492d8"
      },
      {
        "logical_path": "cases/recipes/classic/sc/sc_mono2_i16_multiframe_rle_lossless.json",
        "size_bytes": 2963,
        "sha256": "e84c3e2320d4aa8555e46c3dde98f4412b6236f197d6651ef765c3832cb94c94"
      },
      {
        "logical_path": "cases/recipes/classic/sc/sc_mono2_i16_odd_3x3_rle_lossless.json",
        "size_bytes": 2908,
        "sha256": "4488aa8cc0c1d9e61df0ae41499165a72e0cef124599429beccc0211ff2aaa70"
      },
      {